[
  {
    "group": 1,
    "day": 0,
    "day_name": "Poniedziałek",
    "hour": 10,
    "minute": 30,
    "duration": 180,
    "subject": "Biochemia ćw.",
    "type": null,
    "location": "Katedra Biochemii Lekarskiej (KBL), ul. Kopernika 7",
    "dates": [],
    "time": null
  },
  {
    "group": 2,
    "day": 0,
    "day_name": "Poniedziałek",
    "hour": 10,
    "minute": 30,
    "duration": 180,
    "subject": "Biochemia ćw.",
    "type": null,
    "location": "Katedra Biochemii Lekarskiej (KBL), ul. Kopernika 7",
    "dates": [],
    "time": null
  },
  {
    "group": 2,
    "day": 0,
    "day_name": "Poniedziałek",
    "hour": 14,
    "minute": 15,
    "duration": 90,
    "subject": "Etyka Sem",
    "type": null,
    "location": "Katedra Biochemii Lekarskiej (KBL), ul. Kopernika 7",
    "dates": [],
    "time": null
  },
  {
    "group": 3,
    "day": 0,
    "day_name": "Poniedziałek",
    "hour": 10,
    "minute": 30,
    "duration": 180,
    "subject": "Biochemia ćw.",
    "type": null,
    "location": "Katedra Biochemii Lekarskiej (KBL), ul. Kopernika 7",
    "dates": [],
    "time": null
  },
  {
    "group": 4,
    "day": 0,
    "day_name": "Poniedziałek",
    "hour": 8,
    "minute": 15,
    "duration": 60,
    "subject": "Anatomia",
    "type": "wykład",
    "location": "MS Teams",
    "dates": [],
    "time": null
  },
  {
    "group": 4,
    "day": 0,
    "day_name": "Poniedziałek",
    "hour": 10,
    "minute": 30,
    "duration": 180,
    "subject": "Biochemia ćw.",
    "type": null,
    "location": "Katedra Biochemii Lekarskiej (KBL), ul. Kopernika 7",
    "dates": [],
    "time": null
  },
  {
    "group": 5,
    "day": 0,
    "day_name": "Poniedziałek",
    "hour": 10,
    "minute": 45,
    "duration": 135,
    "subject": "Histologia ćw.",
    "type": null,
    "location": "Katedra Histologii, ul. Kopernika 7",
    "dates": [],
    "time": null
  },
  {
    "group": 5,
    "day": 0,
    "day_name": "Poniedziałek",
    "hour": 14,
    "minute": 0,
    "duration": 90,
    "subject": "Biochemia  Sem.",
    "type": null,
    "location": "Katedra Biochemii Lekarskiej (KBL), ul. Kopernika 7",
    "dates": [],
    "time": null
  },
  {
    "group": 6,
    "day": 0,
    "day_name": "Poniedziałek",
    "hour": 12,
    "minute": 45,
    "duration": 135,
    "subject": "Zaj. Zintegr. z nauk przedklinicznych",
    "type": null,
    "location": "CIEM, ul. Medyczna 7/ KBL, ul. Kopernika 7",
    "dates": [
      "03.XI-26.I"
    ],
    "time": null
  },
  {
    "group": 6,
    "day": 0,
    "day_name": "Poniedziałek",
    "hour": 16,
    "minute": 15,
    "duration": 135,
    "subject": "Histologia ćw.",
    "type": null,
    "location": "Katedra Histologii, ul. Kopernika 7",
    "dates": [],
    "time": null
  },
  {
    "group": 7,
    "day": 0,
    "day_name": "Poniedziałek",
    "hour": 8,
    "minute": 15,
    "duration": 60,
    "subject": "kolokwium 3x testowe",
    "type": null,
    "location": null,
    "dates": [],
    "time": null
  },
  {
    "group": 7,
    "day": 0,
    "day_name": "Poniedziałek",
    "hour": 12,
    "minute": 45,
    "duration": 135,
    "subject": "Zaj. Zintegr. z nauk przedklinicznych",
    "type": null,
    "location": "CIEM, ul. Medyczna 7/ KBL, ul. Kopernika 7",
    "dates": [
      "03.XI-26.I"
    ],
    "time": null
  },
  {
    "group": 7,
    "day": 0,
    "day_name": "Poniedziałek",
    "hour": 16,
    "minute": 15,
    "duration": 135,
    "subject": "Histologia ćw.",
    "type": null,
    "location": "Katedra Histologii, ul. Kopernika 7",
    "dates": [],
    "time": null
  },
  {
    "group": 8,
    "day": 0,
    "day_name": "Poniedziałek",
    "hour": 12,
    "minute": 15,
    "duration": 90,
    "subject": "Biochemia  Sem.",
    "type": null,
    "location": "Katedra Biochemii Lekarskiej (KBL), ul. Kopernika 7",
    "dates": [],
    "time": null
  },
  {
    "group": 8,
    "day": 0,
    "day_name": "Poniedziałek",
    "hour": 14,
    "minute": 15,
    "duration": 90,
    "subject": "Etyka Sem",
    "type": null,
    "location": "Katedra Biochemii Lekarskiej (KBL), ul. Kopernika 7",
    "dates": [],
    "time": null
  },
  {
    "group": 8,
    "day": 0,
    "day_name": "Poniedziałek",
    "hour": 17,
    "minute": 0,
    "duration": 90,
    "subject": "WF",
    "type": null,
    "location": "Studium Wychowania Fizycznego i Sportu, ul. Badurskiego 19",
    "dates": [],
    "time": null
  },
  {
    "group": 9,
    "day": 0,
    "day_name": "Poniedziałek",
    "hour": 10,
    "minute": 15,
    "duration": 135,
    "subject": "Zaj. Zintegr. z nauk przedklinicznych",
    "type": null,
    "location": "CIEM, ul. Medyczna 7/ KBL, ul. Kopernika 7",
    "dates": [
      "03.XI-26.I"
    ],
    "time": null
  },
  {
    "group": 9,
    "day": 0,
    "day_name": "Poniedziałek",
    "hour": 14,
    "minute": 0,
    "duration": 90,
    "subject": "WF",
    "type": null,
    "location": "Studium Wychowania Fizycznego i Sportu, ul. Badurskiego 19",
    "dates": [],
    "time": null
  },
  {
    "group": 10,
    "day": 0,
    "day_name": "Poniedziałek",
    "hour": 10,
    "minute": 45,
    "duration": 90,
    "subject": "Histologia ćw.",
    "type": null,
    "location": "Katedra Histologii, ul. Kopernika 7",
    "dates": [],
    "time": null
  },
  {
    "group": 10,
    "day": 0,
    "day_name": "Poniedziałek",
    "hour": 14,
    "minute": 0,
    "duration": 90,
    "subject": "Biochemia  Sem.",
    "type": null,
    "location": "Katedra Biochemii Lekarskiej (KBL), ul. Kopernika 7",
    "dates": [],
    "time": null
  },
  {
    "group": 11,
    "day": 0,
    "day_name": "Poniedziałek",
    "hour": 10,
    "minute": 30,
    "duration": 90,
    "subject": "Historia Med. Sem",
    "type": null,
    "location": "Katedra Historii Medycyny, ul. Kopernika 7",
    "dates": [
      "24.XI-19.I"
    ],
    "time": null
  },
  {
    "group": 11,
    "day": 0,
    "day_name": "Poniedziałek",
    "hour": 14,
    "minute": 0,
    "duration": 180,
    "subject": "Biochemia ćw.",
    "type": null,
    "location": "Katedra Biochemii Lekarskiej (KBL), ul. Kopernika 7",
    "dates": [],
    "time": null
  },
  {
    "group": 12,
    "day": 0,
    "day_name": "Poniedziałek",
    "hour": 11,
    "minute": 0,
    "duration": 90,
    "subject": "WF",
    "type": null,
    "location": "Studium Wychowania Fizycznego i Sportu, ul. Badurskiego 19",
    "dates": [],
    "time": null
  },
  {
    "group": 12,
    "day": 0,
    "day_name": "Poniedziałek",
    "hour": 14,
    "minute": 0,
    "duration": 180,
    "subject": "Biochemia ćw.",
    "type": null,
    "location": "Katedra Biochemii Lekarskiej (KBL), ul. Kopernika 7",
    "dates": [],
    "time": null
  },
  {
    "group": 13,
    "day": 0,
    "day_name": "Poniedziałek",
    "hour": 12,
    "minute": 15,
    "duration": 90,
    "subject": "Historia Med. Sem",
    "type": null,
    "location": "Katedra Historii Medycyny, ul. Kopernika 7",
    "dates": [
      "24.XI-19.I"
    ],
    "time": null
  },
  {
    "group": 13,
    "day": 0,
    "day_name": "Poniedziałek",
    "hour": 14,
    "minute": 0,
    "duration": 180,
    "subject": "Biochemia ćw.",
    "type": null,
    "location": "Katedra Biochemii Lekarskiej (KBL), ul. Kopernika 7",
    "dates": [],
    "time": null
  },
  {
    "group": 14,
    "day": 0,
    "day_name": "Poniedziałek",
    "hour": 12,
    "minute": 15,
    "duration": 90,
    "subject": "Historia Med. Sem",
    "type": null,
    "location": "Katedra Historii Medycyny, ul. Kopernika 7",
    "dates": [
      "6.X-17.XI"
    ],
    "time": null
  },
  {
    "group": 14,
    "day": 0,
    "day_name": "Poniedziałek",
    "hour": 14,
    "minute": 0,
    "duration": 180,
    "subject": "Biochemia ćw.",
    "type": null,
    "location": "Katedra Biochemii Lekarskiej (KBL), ul. Kopernika 7",
    "dates": [],
    "time": null
  },
  {
    "group": 15,
    "day": 0,
    "day_name": "Poniedziałek",
    "hour": 12,
    "minute": 15,
    "duration": 90,
    "subject": "Biochemia  Sem.",
    "type": null,
    "location": "Katedra Biochemii Lekarskiej (KBL), ul. Kopernika 7",
    "dates": [],
    "time": null
  },
  {
    "group": 15,
    "day": 0,
    "day_name": "Poniedziałek",
    "hour": 17,
    "minute": 0,
    "duration": 90,
    "subject": "WF",
    "type": null,
    "location": "Studium Wychowania Fizycznego i Sportu, ul. Badurskiego 19",
    "dates": [],
    "time": null
  },
  {
    "group": 16,
    "day": 0,
    "day_name": "Poniedziałek",
    "hour": 12,
    "minute": 30,
    "duration": 90,
    "subject": "WF",
    "type": null,
    "location": "Studium Wychowania Fizycznego i Sportu, ul. Badurskiego 19",
    "dates": [],
    "time": null
  },
  {
    "group": 16,
    "day": 0,
    "day_name": "Poniedziałek",
    "hour": 16,
    "minute": 0,
    "duration": 90,
    "subject": "Etyka Sem",
    "type": null,
    "location": "Katedra Biochemii Lekarskiej (KBL), ul. Kopernika 7",
    "dates": [],
    "time": null
  },
  {
    "group": 17,
    "day": 0,
    "day_name": "Poniedziałek",
    "hour": 11,
    "minute": 0,
    "duration": 90,
    "subject": "WF",
    "type": null,
    "location": "Studium Wychowania Fizycznego i Sportu, ul. Badurskiego 19",
    "dates": [],
    "time": null
  },
  {
    "group": 17,
    "day": 0,
    "day_name": "Poniedziałek",
    "hour": 13,
    "minute": 30,
    "duration": 90,
    "subject": "Histologia ćw.",
    "type": null,
    "location": "Katedra Histologii, ul. Kopernika 7",
    "dates": [],
    "time": null
  },
  {
    "group": 18,
    "day": 0,
    "day_name": "Poniedziałek",
    "hour": 10,
    "minute": 30,
    "duration": 90,
    "subject": "Historia Med. Sem",
    "type": null,
    "location": "Katedra Historii Medycyny, ul. Kopernika 7",
    "dates": [
      "6.X-17.XI"
    ],
    "time": null
  },
  {
    "group": 18,
    "day": 0,
    "day_name": "Poniedziałek",
    "hour": 13,
    "minute": 30,
    "duration": 135,
    "subject": "Histologia ćw.",
    "type": null,